{
  "mapping_id": "ft1580-conditional-access-purview-require-compliant-app-001",
  "finding": {
    "technique_id": "T1580",
    "technique_name": "Cloud Infrastructure Discovery",
    "observed_in": [
      "samples/replay-log/R009.json",
      "samples/replay-log/R010.json",
      "samples/replay-log/R011.json"
    ],
    "severity": "medium",
    "rationale": "Enumeration of Purview sensitivity labels via GET /security/dataSecurityAndGovernance/sensitivityLabels reveals the tenant's data classification taxonomy, including label names, enabled state, applicability scope (email, file, teamwork), and whether endpoint protection is active per label. An adversary with label names can direct later Collection techniques toward data classified as Confidential or higher, and route exfiltration through channels or file types that lack label coverage. SensitivityLabel.Read carries no Entra role gate — any user account with the scope consented on the client can call this endpoint. A Conditional Access policy restricting Microsoft Purview Compliance Portal access to approved client applications or compliant devices reduces the surface to organization-managed clients and blocks borrowed FOCI clients."
  },
  "control": {
    "control_family": "conditional_access",
    "control_id": "CA-PUR-001-RequireCompliantApp",
    "control_type": "preventive",
    "microsoft_pillar": "Data",
    "nist_800_207_tenets": ["T3", "T4", "T5"],
    "reference_url": "https://learn.microsoft.com/en-us/entra/identity/conditional-access/concept-filter-for-applications"
  },
  "mapping_metadata": {
    "created_utc": "2026-07-18T00:00:00Z",
    "author": "rejewski",
    "schema_version": "0.1",
    "status": "active"
  }
}
