{
  "mapping_id": "ft1654-rbac-reports-reader-001",
  "finding": {
    "technique_id": "T1654",
    "technique_name": "Log Enumeration",
    "observed_in": [
      "samples/replay-log/R009.json",
      "samples/replay-log/R010.json",
      "samples/replay-log/R011.json"
    ],
    "severity": "high",
    "rationale": "Reading sign-in logs via GET /auditLogs/signIns gives an adversary visibility into the authentication telemetry the defending team uses to detect anomalies. With the full sign-in record an adversary can identify low-detection windows (periods of low sign-in volume), correlate failed then succeeded sign-ins to infer detection thresholds, and determine which accounts generate security alerts — then operate through accounts that do not. AuditLog.Read.All is gated by the Reports Reader role or higher; restricting Reports Reader assignments to designated security operations accounts reduces the number of compromised credential paths that expose authentication telemetry to an adversary. Severity re-triaged medium -> high (2026-09-10) per docs/finding-severity-rubric-v0.1.md v1.0: the defensive-evasion escalator was adopted — a defender's-own-detection map (sign-in/alert telemetry; D=2 sub-case (b)) routes to high. Original point-in-time assessment was medium; preserved here for context."
  },
  "control": {
    "control_family": "rbac",
    "control_id": "Reports Reader",
    "control_type": "preventive",
    "microsoft_pillar": "Identities",
    "nist_800_207_tenets": ["T3", "T4"],
    "reference_url": "https://learn.microsoft.com/en-us/entra/identity/role-based-access-control/permissions-reference#reports-reader"
  },
  "mapping_metadata": {
    "created_utc": "2026-07-18T00:00:00Z",
    "author": "rejewski",
    "schema_version": "0.1",
    "status": "active"
  }
}
