{
  "mapping_id": "ft1078-004-ca-sig003-guests-requiremfa-001",
  "finding": {
    "technique_id": "T1078.004",
    "technique_name": "Valid Accounts: Cloud Accounts",
    "observed_in": [
      "samples/replay-log/R011.json"
    ],
    "severity": "high",
    "rationale": "Guest and external accounts in M365 tenants frequently lack MFA enforcement because default CA policies target only member users. An adversary who obtains a guest credential can acquire a delegated bearer token via ROPC without triggering a secondary factor, then pivot to discovery techniques. Requiring MFA for all guest sign-ins regardless of network location closes this initial-access gap."
  },
  "control": {
    "control_family": "conditional_access",
    "control_id": "CA-SIG003-Guests-RequireMFA",
    "control_type": "preventive",
    "microsoft_pillar": "Identities",
    "nist_800_207_tenets": ["T4", "T6"],
    "reference_url": "https://learn.microsoft.com/en-us/entra/identity/conditional-access/howto-conditional-access-policy-all-users-mfa"
  },
  "mapping_metadata": {
    "created_utc": "2026-05-27T12:30:00Z",
    "author": "rejewski",
    "schema_version": "0.1",
    "status": "active"
  }
}
