{
  "mapping_id": "ft1550-001-rbac-directory-readers-001",
  "finding": {
    "technique_id": "T1550.001",
    "technique_name": "Use Alternate Authentication Material: Application Access Token",
    "observed_in": [],
    "severity": "high",
    "rationale": "Application access token reuse allows an adversary who captures a delegated token to impersonate the victim account for the token's remaining lifetime without re-authenticating. When the compromised account holds Directory Readers or a broader directory role, the replayed token enables full tenant enumeration across users, groups, and role assignments. Scoping service and monitoring accounts to the minimum required role (e.g., a custom limited-read role rather than Directory Readers) reduces the blast radius of token theft and limits what an adversary can enumerate during the valid token window."
  },
  "control": {
    "control_family": "rbac",
    "control_id": "Directory Readers",
    "control_type": "preventive",
    "microsoft_pillar": "Identities",
    "nist_800_207_tenets": ["T4", "T6"],
    "reference_url": "https://learn.microsoft.com/en-us/entra/identity/role-based-access-control/permissions-reference#directory-readers"
  },
  "mapping_metadata": {
    "created_utc": "2026-05-27T12:30:00Z",
    "author": "rejewski",
    "schema_version": "0.1",
    "status": "active"
  }
}
